{
  "schemaVersion": "1.0.0",
  "registryId": "simai.sf-autocomplete",
  "registryVersion": "1.3.0",
  "source": {
    "contractId": "simai.vertical-sizing",
    "contractVersion": "1.3.0",
    "sha256": "b70d02d6902345e17954eafb44f24052b7478439184286bed5a8df6c69c1fe45",
    "repository": "simai/ui-source",
    "commit": "1d26dd483201d24ad1af8419efc21b0d4a76a565",
    "tree": "5b4d11c91ac0716e083554a9a358b0a9deaadab2",
    "path": "src/core/contracts/adaptive-sizing.v1.json"
  },
  "modes": {
    "mobile": {
      "minWidthPx": 0
    },
    "desktop": {
      "minWidthPx": 960
    }
  },
  "scope": {
    "included": [
      "root-rem-policy",
      "mobile-desktop-mode",
      "typography-size-line-height",
      "control-height",
      "block-padding",
      "vertical-spacing",
      "vertical-rhythm"
    ],
    "excluded": [
      "menu-indentation",
      "leading-slot-alignment",
      "inline-padding-parity",
      "container-gutters",
      "container-width",
      "cross-component-horizontal-relations"
    ]
  },
  "entries": [
    {
      "stableId": "simai.vertical-sizing.control.block-padding.default.1",
      "cssName": "--sf-ui-1--space-y-tightness-default",
      "type": "length",
      "category": "control-block-padding",
      "role": "1",
      "modes": {
        "mobile": {
          "alias": "a8",
          "px": 8
        },
        "desktop": {
          "alias": "a8",
          "px": 8
        }
      },
      "aliases": [],
      "componentRelation": "control-tightness:default",
      "lifecycle": {
        "status": "active",
        "deprecated": false,
        "replacementStableId": null
      },
      "completionContexts": [
        "cssVariable",
        "cssValue"
      ],
      "description": "Control block padding 1, tightness default"
    },
    {
      "stableId": "simai.vertical-sizing.control.block-padding.default.1/2",
      "cssName": "--sf-ui-1\\/2--space-y-tightness-default",
      "type": "length",
      "category": "control-block-padding",
      "role": "1/2",
      "modes": {
        "mobile": {
          "alias": "a6",
          "px": 6
        },
        "desktop": {
          "alias": "a6",
          "px": 6
        }
      },
      "aliases": [],
      "componentRelation": "control-tightness:default",
      "lifecycle": {
        "status": "active",
        "deprecated": false,
        "replacementStableId": null
      },
      "completionContexts": [
        "cssVariable",
        "cssValue"
      ],
      "description": "Control block padding 1/2, tightness default"
    },
    {
      "stableId": "simai.vertical-sizing.control.block-padding.default.1/3",
      "cssName": "--sf-ui-1\\/3--space-y-tightness-default",
      "type": "length",
      "category": "control-block-padding",
      "role": "1/3",
      "modes": {
        "mobile": {
          "alias": "a4",
          "px": 4
        },
        "desktop": {
          "alias": "a4",
          "px": 4
        }
      },
      "aliases": [],
      "componentRelation": "control-tightness:default",
      "lifecycle": {
        "status": "active",
        "deprecated": false,
        "replacementStableId": null
      },
      "completionContexts": [
        "cssVariable",
        "cssValue"
      ],
      "description": "Control block padding 1/3, tightness default"
    },
    {
      "stableId": "simai.vertical-sizing.control.block-padding.default.2",
      "cssName": "--sf-ui-2--space-y-tightness-default",
      "type": "length",
      "category": "control-block-padding",
      "role": "2",
      "modes": {
        "mobile": {
          "alias": "b0",
          "px": 10
        },
        "desktop": {
          "alias": "b0",
          "px": 10
        }
      },
      "aliases": [],
      "componentRelation": "control-tightness:default",
      "lifecycle": {
        "status": "active",
        "deprecated": false,
        "replacementStableId": null
      },
      "completionContexts": [
        "cssVariable",
        "cssValue"
      ],
      "description": "Control block padding 2, tightness default"
    },
    {
      "stableId": "simai.vertical-sizing.control.block-padding.default.3",
      "cssName": "--sf-ui-3--space-y-tightness-default",
      "type": "length",
      "category": "control-block-padding",
      "role": "3",
      "modes": {
        "mobile": {
          "alias": "b4",
          "px": 14
        },
        "desktop": {
          "alias": "b0",
          "px": 10
        }
      },
      "aliases": [],
      "componentRelation": "control-tightness:default",
      "lifecycle": {
        "status": "active",
        "deprecated": false,
        "replacementStableId": null
      },
      "completionContexts": [
        "cssVariable",
        "cssValue"
      ],
      "description": "Control block padding 3, tightness default"
    },
    {
      "stableId": "simai.vertical-sizing.control.block-padding.high.1",
      "cssName": "--sf-ui-1--space-y-tightness-high",
      "type": "length",
      "category": "control-block-padding",
      "role": "1",
      "modes": {
        "mobile": {
          "alias": "b2",
          "px": 12
        },
        "desktop": {
          "alias": "b2",
          "px": 12
        }
      },
      "aliases": [],
      "componentRelation": "control-tightness:high",
      "lifecycle": {
        "status": "active",
        "deprecated": false,
        "replacementStableId": null
      },
      "completionContexts": [
        "cssVariable",
        "cssValue"
      ],
      "description": "Control block padding 1, tightness high"
    },
    {
      "stableId": "simai.vertical-sizing.control.block-padding.high.1/2",
      "cssName": "--sf-ui-1\\/2--space-y-tightness-high",
      "type": "length",
      "category": "control-block-padding",
      "role": "1/2",
      "modes": {
        "mobile": {
          "alias": "b0",
          "px": 10
        },
        "desktop": {
          "alias": "b0",
          "px": 10
        }
      },
      "aliases": [],
      "componentRelation": "control-tightness:high",
      "lifecycle": {
        "status": "active",
        "deprecated": false,
        "replacementStableId": null
      },
      "completionContexts": [
        "cssVariable",
        "cssValue"
      ],
      "description": "Control block padding 1/2, tightness high"
    },
    {
      "stableId": "simai.vertical-sizing.control.block-padding.high.1/3",
      "cssName": "--sf-ui-1\\/3--space-y-tightness-high",
      "type": "length",
      "category": "control-block-padding",
      "role": "1/3",
      "modes": {
        "mobile": {
          "alias": "a6",
          "px": 6
        },
        "desktop": {
          "alias": "a8",
          "px": 8
        }
      },
      "aliases": [],
      "componentRelation": "control-tightness:high",
      "lifecycle": {
        "status": "active",
        "deprecated": false,
        "replacementStableId": null
      },
      "completionContexts": [
        "cssVariable",
        "cssValue"
      ],
      "description": "Control block padding 1/3, tightness high"
    },
    {
      "stableId": "simai.vertical-sizing.control.block-padding.high.2",
      "cssName": "--sf-ui-2--space-y-tightness-high",
      "type": "length",
      "category": "control-block-padding",
      "role": "2",
      "modes": {
        "mobile": {
          "alias": "b4",
          "px": 14
        },
        "desktop": {
          "alias": "b4",
          "px": 14
        }
      },
      "aliases": [],
      "componentRelation": "control-tightness:high",
      "lifecycle": {
        "status": "active",
        "deprecated": false,
        "replacementStableId": null
      },
      "completionContexts": [
        "cssVariable",
        "cssValue"
      ],
      "description": "Control block padding 2, tightness high"
    },
    {
      "stableId": "simai.vertical-sizing.control.block-padding.high.3",
      "cssName": "--sf-ui-3--space-y-tightness-high",
      "type": "length",
      "category": "control-block-padding",
      "role": "3",
      "modes": {
        "mobile": {
          "alias": "c0",
          "px": 20
        },
        "desktop": {
          "alias": "b6",
          "px": 16
        }
      },
      "aliases": [],
      "componentRelation": "control-tightness:high",
      "lifecycle": {
        "status": "active",
        "deprecated": false,
        "replacementStableId": null
      },
      "completionContexts": [
        "cssVariable",
        "cssValue"
      ],
      "description": "Control block padding 3, tightness high"
    },
    {
      "stableId": "simai.vertical-sizing.control.block-padding.highest.1",
      "cssName": "--sf-ui-1--space-y-tightness-highest",
      "type": "length",
      "category": "control-block-padding",
      "role": "1",
      "modes": {
        "mobile": {
          "alias": "b6",
          "px": 16
        },
        "desktop": {
          "alias": "b6",
          "px": 16
        }
      },
      "aliases": [],
      "componentRelation": "control-tightness:highest",
      "lifecycle": {
        "status": "active",
        "deprecated": false,
        "replacementStableId": null
      },
      "completionContexts": [
        "cssVariable",
        "cssValue"
      ],
      "description": "Control block padding 1, tightness highest"
    },
    {
      "stableId": "simai.vertical-sizing.control.block-padding.highest.1/2",
      "cssName": "--sf-ui-1\\/2--space-y-tightness-highest",
      "type": "length",
      "category": "control-block-padding",
      "role": "1/2",
      "modes": {
        "mobile": {
          "alias": "b4",
          "px": 14
        },
        "desktop": {
          "alias": "b4",
          "px": 14
        }
      },
      "aliases": [],
      "componentRelation": "control-tightness:highest",
      "lifecycle": {
        "status": "active",
        "deprecated": false,
        "replacementStableId": null
      },
      "completionContexts": [
        "cssVariable",
        "cssValue"